{
  "id": "sintesis-directa-m9",
  "caso_id": "zapatero-plus-ultra",
  "medicion_ref": "M9",
  "tipo": "sintesis",
  "titulo": "Síntesis de Medición M9",
  "fecha": "2026-06-18",
  "prompt_analisis": "docs/prompts/lectura_pack_ciudadano.prompt.md",
  "pack_ref": "zapatero-plus-ultra-M9.zip",
  "lienzo": "site/templates/prensa/lienzo_fragmento.html",
  "resumen": "Contraste directo entre sincronía política e integridad probatoria."
}
